H216	Syakhril meyakini ini syal merah putih Syukri Ilyas.	Syakh-ril meyakini ini syal mErah putih Syuk-ri Ilyas.
H217	Syarat yang dimaksudnya sesuai tata tertib PKB.	Syarat yang dimaksudnya sesuai tata tertib PE-KA-BE.
H218	Syaratnya apa saja? tanya Rois Syuriah.	Syaratnya apa saja? tanya Rois Syuriah.
H219	Syarat-syaratnya apa saja? tanya Syamsul.	Syarat-syaratnya apa saja? tanya Syamsul.
H220	Yang memakai tanda pengenal tamu berlogo Pengayom Depkeh warna kuning.	Yang memakai tanda pengenal tamu berlogo Pengayom DEpkEh warna kuning.
H221	Hal itu mengganggunya baik secara fisik maupun moral psikisnya.	Hal itu mengganggunya baik secara fisik maupun moral psikisnya.
H222	Syiah Kuala sendiri sekarang dihadapkan pada permasalahan pendidikan, katanya.	Syi-ah Kuala sendiri sekarang dihadapkan pada permasalahan pendidikan, katanya.
H223	Tadinya saya diajak ngobrol-ngobrol, Syed mengakui.	Tadinya saya diajak ngobrol-ngobrol, SyEd mengakui.
H224	Tagihan biaya air bulan ini berapa?	Tagihan biaya air bulan ini berapa?
H225	Tagihan kamar Satu delapan satu sembilan untuk bulan ini berapa?	Tagihan kamar Satu delapan satu sembilan untuk bulan ini berapa?
H226	Tagihan telkom kadang-kadang disebut tagihan telefon atau tagihan telepon.	Tagihan TElkom kadang-kadang disebut tagihan telefon atau tagihan telepon.
H227	Yang lainnya tidak terdaftar karena mereka umumnya hanya indekost saja.	Yang lainnya tidak terdaftar karena mereka umumnya hanya indekost saja.
H228	Yang melampaui garis dan sudah mulai memasuki masalah-masalah intern kita.	Yang melampaui garis dan sudah mulai memasuki masalah-masalah intern kita.
H229	Tahapan pemulihan pascagempa dibagi menjadi empat.	Tahapan pemulihan paskagempa dibagi menjadi empat.
H230	Tahu dan oncom Saudara Agus digemari sejumlah pegawai honorer Pemerintah Kota.	Tahu dan oncom Saudara Agus digemari sejumlah pegawai honorEr Pemerintah Kota.
H231	Tahu enggak satu orang sedang ke Jerusalem setelah Swiss.	Tahu engga satu orang sedang ke JErusalEm setelah Swiss.
H232	Tahun Uang Palsu dimanfaatkan oleh obligor.	Tahun Uang Palsu dimanfaatkan olEh obligor.
H233	Tak hanya kafe yang diuntungkan malam itu, tambah Neiss.	Tak hanya kafE yang diuntungkan malam itu, tambah NEiss.
H234	Tak menyentuh angka lima belas tambah Ical.	Tak menyentuh angka lima belas, tambah Ical.
H235	Tak urung dia risau menghadapi hari esok, tambah Kwik.	Tak urung dia risau menghadapi hari Esok, tambah Kwik.
H236	Takut Tsunami, warga mengungsi ke Bukit.	Takut Tsunami, warga mengungsi ke Bukit di Bualemo.
H237	Tampak Mustaine cuma komat-kamit.	Tampak Mustain cuman komat-kamit.
H238	Tamzil dan Balfas sudah dibebaskan tambah Wolfensohn.	Tamzil dan Balfas sudah dibEbaskan, tambah Wol-fEn-sohn.
H239	Tanah ikut hanyut ke danau yang airnya berwarna hijau jernih.	Tanah ikut hanyut ke danau yang airnya berwarna hijau jernih.
H240	Tanda-tanda itu muncul di lereng pegunungan antara Sukorejo sampai Weleri.	Tanda-tanda itu muncul di lErEng pegunungan antara Sukorejo sampai Weleri.
H241	Tanggal berapa kami harus bayar tagihan air PAM atau biaya air PAM?	Tanggal berapa kami harus bayar tagihan air PAM atau biaya air PAM?
H242	Yang lainnya penduduk setempat, termasuk seorang wanita, istri Syekh Yasin.	Yang lainnya penduduk setempat, termasuk seorang wanita, istri SyEkh Yasin.
H243	Tanggal dua puluh lima oktober dua ribu lima di bulan Dzulhijjah.	Tanggal dua puluh lima oktober dua ribu lima di bulan Dzulhijjah.
H244	Tanpa dipotong utang, tambah Jiang Zemin.	Tanpa dipotong utang, tambah Ji-ang Zemin.
H245	Tanpa disebutkan detail caranya tambah Roy.	Tanpa disebutkan de-ta-il caranya, tambah Roy.
H246	Tanya saja respons daerah ke Ruke tambah Taufiq.	Tanya saja rEspons daErah ke Ruke, tambah Taufiq.
H247	Tanya saja sama pak Widodo dan pak Tyasno, katanya.	Tanya saja sama pak Widodo dan pak Ti-yas-no, katanya.
H248	Tanyakan sendiri ke Tommy kalau dia ketangkep nanti.	Tanyakan sendiri ke Tommi kalau dia ketangkep nanti.
H249	Tapi disepakati RUU yang lainnya maupun ebtanas melalui otonomi, kata Indra.	Tapi disepakati ER-U-U yang lainnya maupun Ebtanas melalui otonomi, kata Indra.
H250	Tapi entah kenapa tanpa tarif minimum tanya Suzetta.	Tapi entah kenapa tanpa tarif minimum, tanya Su-zEt-ta.
H251	Tapi entahlah, nilai Ebtanas murni atau tidak hanya kau yang tahu.	Tapi entahlah, nilai Ebtanas murni atau tidak hanya kau yang tahu.
H252	Tapi habis itu kau jangan tidur dulu ya.	Tapi habis itu kau jangan tidur dulu ya.
H253	Tapi IMF khawatir tak ada embargo oleh AS.	Tapi I-EM-EF khawatir tak ada Embargo olEh A-ES.
H254	Tapi juga usut kenapa pukat harimau bisa beroperasi ujar Yusril ke Susi.	Tapi juga usut kenapa pukat harimau bisa beroperasi ujar Yusril ke Susi.
H255	Tapi karena faktor lain, kata Roy tanpa merinci maksud ucapannya.	Tapi karena faktor lain, kata Roy tanpa merinci maksud ucapannya.
H256	Tapi menurut Kapuskodalops lukanya Sugiyanto enggak parah.	Tapi menurut Ka-pus-ko-da-lops lukanya Sugiyanto enggak parah.
H257	Tapi menurut Syed Hamid Albar itu gampang, itu urusan kacang kwaci.	Tapi menurut SyEd Hamid Albar itu gampang, itu urusan kacang kwaci.
H258	Tapi menurut versi Walhi NTB, hal ini dibantah Sofyan Tsauri.	Tapi menurut vErsi Walhi EN-TE-BE, hal ini dibantah Sof-yan Sau-ri.
H259	Tapi nadanya pahit, penuh ejekan pada diri sendiri.	Tapi nadanya pahit, penuh EjEkan pada diri sendiri.
H260	Tapi Nikko uang Likuid kemudian dipakai untuk foya-foya.	Tapi Nikko uang Li-ku-id kemudian dipakai untuk foya-foya.
H261	Tapi orangnya kalem jadi kita lihatnya suka.	Tapi orangnya kalem, jadi kita lihatnya suka.
H262	Tapi syukurlah tawuran hanya berlangsung saling ejek.	Tapi syukurlah tawuran hanya berlangsung saling EjEk.
H263	Tapi Zeldy yakin, Wahid mampu untuk memulai usahanya.	Tapi ZEldy yakin, Wahid mampu untuk memulai usahanya.
H264	Tapi, calonnya tidak serta-merta dari Aisyiyah.	Tapi, calonnya tidak serta-merta dari A-i-syi-yah.
H265	Tapi, pasukan Brimob juga disatroni.	Tapi, pasukan Brimob juga disatroni.
H266	Tapi, saya kira, Indorayon nggak sanggup untuk itu.	Tapi, saya kira, Indorayon nggak sanggup untuk itu.
H267	Target Penerimaan Devisa Bea dan Cukai terlampaui.	TargEt Penerimaan DEvisa BEa dan Cukai terlampaui.
H268	Tarif listrik dan tarif cukai tidak pakai rentang waktu lagi.	Tarif listrik dan tarif cukai tidak pakai rentang waktu lagi.
H269	Tarman Azzam, Zumrotin, dan Tarmidzi Hakim telah mengecoh konsumen.	Tarman Azzam, Zumrotin, dan Tarmidzi Hakim telah mengEcoh konsumEn.
H270	Taruh kata seperti penampilan penyanyi Chrisye.	Taruh kata seperti penampilan penyanyi Khrisye.
H271	Taslam merasa yakin Mega terlampau cepat memajukan para teman barunya.	Taslam merasa yakin MEga terlampau cepat memajukan para teman barunya.
H272	Taufik Kiemas soal Hartini Soekarno, ia ibu yang baik.	Taufik Kiemas soal Hartini Sukarno, ia ibu yang baik.
H273	Taufiq Kiemas dan Sabarno enggan menjawab.	Taufiq Kiemas dan Sabarno enggan menjawab.
H274	Tefa yakin kepulangan pengungsi Timtim bakal terus meningkat.	Tefa yakin kepulangan pengungsi Timtim bakal terus meningkat.
H275	Teguh menilai Slamet sebagai orang yang rajin.	Teguh menilai Slamet sebagai orang yang rajin.
H276	Telah dipasang ranjau bom rakitan secara detail, tegas Wiwoho sebagai staf lapangan.	Telah dipasang ranjau bom rakitan secara de-ta-il, tegas Wiwoho sebagai staf lapangan.
H277	Telah mengamankan salah satu provokator perusakan rumah Muhiyi Effendy.	Telah mengamankan salah satu provokator perusakan rumah Mu-hi-yi Ef-fEndy.
H278	Telah muncul Orde Baru jilid dua, tegas Zulkifli.	Telah muncul Orde Baru jilid dua, tegas Zulkifli.
H279	Telepon rusak oleh Syarif sendiri, tegas Yozi sebagai saudara.	Telepon rusak olEh Syarif sendiri, tegas Yozi sebagai saudara.
H280	Teleskop Hubble saja, tegas Chaerul lagi sebagai ahli elektro.	TElEskop HA-bel saja, tegas KhaErul lagi sebagai ahli ElEktro.
H281	Dalam aksi unjuk rasa damai di tempat Gedung DPRD DIY berada.	Dalam aksi unjuk rasa damai di tempat Gedung DE-PE-ER-DE DE-I-YE berada.
H282	Tempat gen tersimpan diawasi sebelas orang saja.	Tempat gEn tersimpan diawasi sebelas orang saja.
H283	Tempat kelompok Mbah Jenggot dan kelompoknya tinggal.	Tempat kelompok Mbah JEnggot dan kelompoknya tinggal.
H284	Tempat ngaso juga banyak di Rantau Badak.	Tempat ngaso juga banyak di Rantau Badak.
H285	Tempat Pembuatan KTP yang dekatnya bandung supermall? Tanya Yusuf Muhammad.	Tempat Pembuatan KA-TE-PE yang dekatnya bandung supermall? Tanya Yusuf Muhammad.
H286	Tengoklah pusat grosir di Pasar Pagi atau Glodok secara berduyun-duyun.	TEngoklah pusat grosir di Pasar Pagi atau Glodok secara berduyun-duyun.
H287	Tentang nasib Josef Estrada sejak kredit cair.	Tentang nasib JosEf Estrada sejak krEdit cair.
H288	Tentu ada konsekwensinya, terang Sjafrie.	Tentu ada kon-se-ku-wEn-sinya, terang Syaf-ri.
H289	Tentu saja dengan imbalan uang, imbuh Zakiah.	Tentu saja dengan imbalan uang, imbuh Zakiah.
H290	Tepat pukul delapan silakan terangkan seluruh lampu.	Tepat pukul delapan silakan terangkan seluruh lampu.
H291	Tepat pukul dua belas bunga teratai Maspun bermekaran.	Tepat pukul dua belas bunga teratai Maspun bermekaran.
H292	Tepat pukul lima upacara terasa semarak namun khidmat.	Tepat pukul lima upacara terasa semarak namun khidmat.
H293	Tepat sekali! Kita menyucikan Bumi Siliwangi teriak Zulfadli.	Tepat sekali! Kita menyucikan Bumi Siliwangi, teriak Zulfadli.
H294	Terdapat belokan arus sungai yang tajam.	Terdapat bElokan arus sungai yang tajam.
H295	Terdengar nyaring yel-yel berbunyi usai orasi mahasiswa di Bundaran HI.	Terdengar nyaring yEl-yEl berbunyi usai orasi mahasiswa di Bundaran HA-I.
H296	Terdiri dari para cerdik pandai yang mumpuni dalam bidangnya.	Terdiri dari para cerdik pandai yang mumpuni dalam bidangnya.
H297	Tergantung nilai tukar mata uang dan variabel-variabel lain.	Tergantung nilai tukar mata uang dan variabel-variabel lain.
H298	Terima kasih kembali teriak Josis Siswoyo.	Terima kasih kembali teriak Josis Siswoyo.
H299	Terkadang perwira belum ngomong sudah diantisipasi ngomong ini.	Terkadang perwira belum ngomong, sudah diantisipasi ngomong ini.
H300	Termasuk Khofifah Indar Parawansa yang mewakili unsur perempuan.	Termasuk Khofifah Indar Parawansa yang mewakili unsur perempuan.
